url,book_id,title,award_count,author,avg_rating,num_reviews,num_ratings,num_pages,original_publish_year,series,genres,awards,place
https://www.goodreads.com/book/show/4894.Who_Moved_My_Cheese_,4894.0,Who Moved My Cheese?,0,Spencer Johnson,3.83,388594.0,388594.0,96.0,1998.0,True,"Nonfiction, Self Help, Business, Psychology, Leadership, Self Help, Personal Development, Business, Management, Philosophy, Inspirational, Audiobook",,
https://www.goodreads.com/book/show/597790.The_Children_of_H_rin,597790.0,The Children of Húrin,1,J.R.R. Tolkien,3.96,71407.0,71407.0,313.0,2007.0,False,"Fantasy, Fiction, Classics, Fantasy, High Fantasy, Fantasy, Epic Fantasy, Adventure, Science Fiction Fantasy, Young Adult, Childrens, Novels",Tähtifantasia Award Nominee (2008),Middle-earth
https://www.goodreads.com/book/show/10204213-the-traitor-s-emblem,10204213.0,The Traitor's Emblem,1,Juan Gomez-Jurado,3.83,2703.0,2703.0,317.0,2008.0,False,"Historical, Historical Fiction, Fiction, Mystery, Thriller, Historical, Cultural, Germany, European Literature, Spanish Literature, Thriller, Mystery Thriller, Cultural, Spain, Adventure",Premio Novela Ciudad de Torrevieja (2008),Munich (München)
https://www.goodreads.com/book/show/517188.The_Prime_of_Miss_Jean_Brodie,517188.0,The Prime of Miss Jean Brodie,0,Muriel Spark,3.73,44341.0,44341.0,150.0,1961.0,False,"Fiction, Classics, Historical, Historical Fiction, Cultural, Scotland, European Literature, British Literature, Novels, Literature, 20th Century, Literature, Classics, Modern Classics, Literary Fiction",,"Scotland, Edinburgh, Scotland"
https://www.goodreads.com/book/show/18452.The_Painted_Bird,18452.0,The Painted Bird,1,Jerzy Kosiński,3.92,22102.0,22102.0,234.0,1965.0,False,"Fiction, Historical, Historical Fiction, Classics, War, Literature, Horror, World War II, Holocaust, War, World War II, Novels, European Literature, Polish Literature",Prix du Meilleur Livre Étranger for Essai (1966),
https://www.goodreads.com/book/show/21348.Aesop_s_Fables,21348.0,Aesop's Fables,0,Aesop,4.05,116391.0,116391.0,306.0,-560.0,False,"Classics, Fiction, Short Stories, Childrens, Fantasy, Literature, Fantasy, Mythology, Fantasy, Fairy Tales, Philosophy, Folklore",,
https://www.goodreads.com/book/show/34517.Reaper_Man,34517.0,Reaper Man,0,Terry Pratchett,4.25,88646.0,88646.0,352.0,1991.0,True,"Fantasy, Fiction, Humor, Humor, Comedy, Science Fiction Fantasy, Young Adult, Audiobook, Childrens, Adventure, Death",,"Discworld, Ankh-Morpork"
https://www.goodreads.com/book/show/18386.The_Death_of_Ivan_Ilych,18386.0,The Death of Ivan Ilych,0,Leo Tolstoy,4.09,103043.0,103043.0,86.0,1886.0,False,"Classics, Fiction, Cultural, Russia, Literature, Russian Literature, Literature, Short Stories, Philosophy, Literature, 19th Century, Novels, Novella",,
https://www.goodreads.com/book/show/213753.Life_As_We_Knew_It,213753.0,Life As We Knew It,10,Susan Beth Pfeffer,3.87,120537.0,120537.0,337.0,2006.0,True,"Young Adult, Science Fiction, Dystopia, Science Fiction, Fiction, Apocalyptic, Post Apocalyptic, Adventure, Survival, Science Fiction, Apocalyptic, Young Adult, Teen, Fantasy, Audiobook","Buxtehuder Bulle (2010), South Carolina Book Award Nominee for Young Adult Book (2009), Rhode Island Teen Book Award Nominee (2008), Evergreen Teen Book Award (2009), The Inky Awards Nominee for Silver Inky (2008), California Young Readers Medal Nominee for Young Adult (2009), Andre Norton Award Nominee (2006), Missouri Truman Readers Award (2009), Missouri Gateway Readers Award Nominee (2009), Rebecca Caudill Young Readers' Book Award Nominee (2009)","Pennsylvania, Howell, Pennsylvania"
https://www.goodreads.com/book/show/7905092-freedom,7905092.0,Freedom,7,Jonathan Franzen,3.76,155317.0,155317.0,562.0,2010.0,False,"Fiction, Contemporary, Novels, Literary Fiction, Literature, Literature, American, Adult Fiction, Family, Audiobook, Book Club","Warwick Prize for Writing Nominee for Longlist (2013), Los Angeles Times Book Prize Nominee for Fiction (2010), Chicago Tribune Heartland Prize for Fiction (2011), National Book Critics Circle Award Nominee for Fiction (2010), Bad Sex in Fiction Award Nominee (2010), John Gardner Book Award for Fiction (2011), Goodreads Choice Award Nominee for Favorite Book and for Fiction (2010)",
https://www.goodreads.com/book/show/19117.Fathers_and_Sons,19117.0,Fathers and Sons,0,Ivan Turgenev,3.96,73523.0,73523.0,244.0,1862.0,False,"Classics, Fiction, Cultural, Russia, Literature, Russian Literature, Literature, Literature, 19th Century, Novels, Historical, Historical Fiction, Philosophy, Literary Fiction",,Russian Empire
https://www.goodreads.com/book/show/9539.The_Shadow_Rising,9539.0,The Shadow Rising,0,Robert Jordan,4.23,181040.0,181040.0,1007.0,1992.0,True,"Fantasy, Fiction, Fantasy, Epic Fantasy, Science Fiction Fantasy, Fantasy, High Fantasy, Adventure, Epic, Audiobook, Young Adult, Fantasy, Magic",,
https://www.goodreads.com/book/show/5152478-wintergirls,5152478.0,Wintergirls,10,Laurie Halse Anderson,3.96,111069.0,111069.0,278.0,2009.0,False,"Young Adult, Contemporary, Fiction, Realistic Fiction, Health, Mental Health, Mental Health, Mental Illness, Young Adult, Teen, Death, Young Adult, High School, Young Adult, Young Adult Contemporary","Romantic Times Reviewers' Choice Award (RT Award) Nominee for Best Young Adult Novel (2009), Rhode Island Teen Book Award Nominee (2011), Milwaukee County Teen Book Award (2010), Michigan Library Association Thumbs Up! Award Nominee (2010), Iowa High School Book Award Nominee (2011), Lincoln Award Nominee (2014), CYBILS Award Nominee for Young Adult Fiction (2009), Literaturpreis der Jury der jungen Leser for Cover (2011), Goodreads Choice Award Nominee for Young Adult Fiction (2009), Premio El Templo de las Mil Puertas Nominee for Mejor novela extranjera independiente (2010)",New Hampshire
https://www.goodreads.com/book/show/95617.A_Voice_in_the_Wind,95617.0,A Voice in the Wind,0,Francine Rivers,4.56,77445.0,77445.0,520.0,1993.0,True,"Christian Fiction, Historical, Historical Fiction, Christian, Fiction, Romance, Historical, Romance, Historical Romance, Adult, Romance, Christian Romance, Religion",,
https://www.goodreads.com/book/show/321645.Kissed_by_an_Angel_The_Power_of_Love_Soulmates,321645.0,Kissed by an Angel/The Power of Love/Soulmates,0,Elizabeth Chandler,4.08,25514.0,25514.0,690.0,1995.0,True,"Young Adult, Romance, Paranormal, Angels, Fantasy, Fantasy, Paranormal, Mystery, Fiction, Romance, Paranormal Romance, Fantasy, Supernatural, Young Adult, Teen",,
https://www.goodreads.com/book/show/7278752-dolores-claiborne,7278752.0,Dolores Claiborne,0,Stephen King,3.88,130818.0,130818.0,384.0,1992.0,False,"Horror, Fiction, Thriller, Mystery, Suspense, Mystery, Crime, Audiobook, Thriller, Mystery Thriller, Drama, Adult",,Little Tall Island
https://www.goodreads.com/book/show/38743.All_Things_Bright_and_Beautiful,38743.0,All Things Bright and Beautiful,1,James Herriot,4.3,70074.0,70074.0,378.0,1974.0,True,"Nonfiction, Animals, Autobiography, Memoir, Biography, Classics, Humor, Biography, Autobiography, Biography Memoir, European Literature, British Literature, Environment, Nature",California Young Readers Medal Nominee for Young Adult (1977),"United Kingdom, Yorkshire, England"
https://www.goodreads.com/book/show/40949958-treacherous-estate,40949958.0,Treacherous Estate,0,Behcet Kaya,4.28,6978.0,6978.0,314.0,2018.0,False,"Fiction, Contemporary, Novels, Drama, Epic",,
https://www.goodreads.com/book/show/15753740-the-storyteller,15753740.0,The Storyteller,1,Jodi Picoult,4.27,179833.0,179833.0,461.0,2013.0,False,"Fiction, Historical, Historical Fiction, World War II, Holocaust, Historical, Contemporary, Adult Fiction, War, World War II, Adult, War, Drama",Goodreads Choice Award Nominee for Fiction (2013),"Westerbrook, New Hampshire, New Hampshire, Poland, Lodz"
https://www.goodreads.com/book/show/29056083-harry-potter-and-the-cursed-child,29056083.0,Harry Potter and the Cursed Child: Parts One and Two,3,John Tiffany,3.59,755778.0,755778.0,343.0,2016.0,True,"Fantasy, Fiction, Young Adult, Plays, Fantasy, Magic, Adventure, Drama, Childrens, Science Fiction, Time Travel, Childrens, Middle Grade","Australian Book Industry Award (ABIA) Nominee for International Book (2017), Goodreads Choice Award for Fantasy (2016), Waterstones Book of the Year Nominee (2016)",
https://www.goodreads.com/book/show/6339989-vampire-academy-collection,6339989.0,Vampire Academy Collection,0,Richelle Mead,4.61,33800.0,33800.0,1120.0,2009.0,True,"Paranormal, Vampires, Fantasy, Young Adult, Fantasy, Paranormal, Romance, Fantasy, Supernatural, Romance, Paranormal Romance, Fiction, Young Adult, Young Adult Fantasy, Fantasy, Urban Fantasy",,
https://www.goodreads.com/book/show/17184.The_Invisible_Man,17184.0,The Invisible Man,0,H.G. Wells,3.64,156070.0,156070.0,192.0,1897.0,False,"Classics, Science Fiction, Fiction, Fantasy, Horror, Literature, Audiobook, Novels, Science Fiction Fantasy, Literature, 19th Century",,United Kingdom
https://www.goodreads.com/book/show/17617277-real,17617277.0,Real,1,Katy Evans,4.19,101783.0,101783.0,293.0,2013.0,True,"Romance, New Adult, Contemporary, Romance, Contemporary Romance, Sports, Sports, Warfare, Fighters, Adult Fiction, Erotica, Contemporary Romance, Sports Romance, Adult, Romance, Erotic Romance",Goodreads Choice Award Nominee for Romance and for Debut Author (2013),
https://www.goodreads.com/book/show/24830.The_Illustrated_Man,24830.0,The Illustrated Man,2,Ray Bradbury,4.12,84267.0,84267.0,186.0,1951.0,False,"Science Fiction, Short Stories, Fiction, Classics, Fantasy, Horror, Science Fiction Fantasy, Literature, Anthologies, Literature, American","International Fantasy Award Nominee for Fiction (1952), Analog Award Nominee for All-Time Best Book (1952)",
https://www.goodreads.com/book/show/431.The_New_York_Trilogy,431.0,The New York Trilogy,0,Paul Auster,3.87,65395.0,65395.0,308.0,1987.0,True,"Fiction, Mystery, Literature, American, Novels, Contemporary, Literature, New York, The United States Of America, Mystery, Crime, Classics",,"Manhattan, New York City, New York, New York City, New York"
https://www.goodreads.com/book/show/91203.Three_Comrades,91203.0,Three Comrades,0,Erich Maria Remarque,4.49,26279.0,26279.0,496.0,1936.0,False,"Classics, Fiction, European Literature, German Literature, Historical, Historical Fiction, War, Cultural, Germany, Literature, Novels, Historical, Drama",,"Berlin, Paris"
https://www.goodreads.com/book/show/6507691-the-manufactured-identity,6507691.0,The Manufactured Identity,0,Heath Sommer,3.53,422.0,422.0,305.0,2009.0,True,"Mystery, Fiction, Psychology, Thriller, Thriller, Mystery Thriller, Suspense, Thriller, Psychological Thriller, Contemporary, Historical, Historical Fiction, Mystery, Crime",,United States of America
https://www.goodreads.com/book/show/147915.A_Storm_of_Swords,147915.0,A Storm of Swords: Blood and Gold,1,George R.R. Martin,4.5,86321.0,86321.0,639.0,2000.0,True,"Fantasy, Fiction, Fantasy, Epic Fantasy, Fantasy, High Fantasy, Adventure, Young Adult, Childrens, Adult, Fantasy, Dragons, Childrens, Middle Grade",Tähtifantasia Award Nominee (2007),
https://www.goodreads.com/book/show/112537.Rendezvous_with_Rama,112537.0,Rendezvous with Rama,7,Arthur C. Clarke,4.1,139080.0,139080.0,243.0,1973.0,True,"Science Fiction, Fiction, Classics, Science Fiction Fantasy, Space, Science Fiction, Aliens, Hugo Awards, Novels, Audiobook, Fantasy","Hugo Award for Best Novel (1974), Nebula Award for Best Novel (1973), Locus Award for Best Novel (1974), British Science Fiction Association Award for Novel (1973), Jupiter Award for Best Novel (1974), John W. Campbell Memorial Award for Best Science Fiction Novel (1974), Seiun Award 星雲賞 for Best Foreign Novel (1980)",
https://www.goodreads.com/book/show/33516773-big-little-lies,33516773.0,Big Little Lies,3,Liane Moriarty,4.28,794963.0,794963.0,460.0,2014.0,False,"Fiction, Mystery, Contemporary, Womens Fiction, Chick Lit, Audiobook, Adult, Thriller, Thriller, Mystery Thriller, Adult Fiction, Cultural, Australia","Davitt Award for Best Adult Novel (2015), Australian Book Industry Award (ABIA) Nominee for General Fiction (2015), Goodreads Choice Award Nominee for Fiction (2014)","Sydney, New South Wales"
https://www.goodreads.com/book/show/48464.A_Good_Man_is_Hard_to_Find_and_Other_Stories,48464.0,A Good Man is Hard to Find and Other Stories,0,Flannery O'Connor,4.21,39792.0,39792.0,252.0,1955.0,False,"Short Stories, Fiction, Classics, Gothic, Southern Gothic, Literature, American, Southern, Literature, American, Gothic, Literary Fiction, Literature, 20th Century",,
https://www.goodreads.com/book/show/17803.After_Dark,17803.0,After Dark,1,Haruki Murakami,3.71,117514.0,117514.0,191.0,2004.0,False,"Fiction, Cultural, Japan, Asian Literature, Japanese Literature, Magical Realism, Contemporary, Novels, Literature, Fantasy, Cultural, Asia, Literature, Asian Literature",International Dublin Literary Award Nominee (2009),Tokyo
https://www.goodreads.com/book/show/27208.The_Third_Policeman,27208.0,The Third Policeman,2,Flann O'Brien,4.0,16773.0,16773.0,200.0,1967.0,False,"Fiction, European Literature, Irish Literature, Cultural, Ireland, Fantasy, Classics, Humor, Novels, Literature, Mystery, Literature, 20th Century","Tähtivaeltaja Award (1989), Premi Llibreter de narrativa Nominee (2007)",Ireland
https://www.goodreads.com/book/show/284440.Skulduggery_Pleasant,284440.0,Skulduggery Pleasant,6,Derek Landy,4.13,57326.0,57326.0,392.0,2007.0,True,"Fantasy, Young Adult, Mystery, Fiction, Fantasy, Urban Fantasy, Fantasy, Magic, Adventure, Childrens, Middle Grade, Fantasy, Paranormal, Childrens","Mythopoeic Fantasy Award Nominee for Children's Literature (2008), Odyssey Award Nominee (2008), Red House Children's Book Award for Older Readers & Overall (2008), Bolton Children's Book Award (2008), California Young Readers Medal Nominee for Middle School/Junior High (2011), Carnegie Medal Nominee (2008)",Ireland
https://www.goodreads.com/book/show/15575.The_Sword_of_Shannara,15575.0,The Sword of Shannara,1,Terry Brooks,3.76,90879.0,90879.0,726.0,1977.0,True,"Fantasy, Fiction, Fantasy, Epic Fantasy, Science Fiction Fantasy, Young Adult, Fantasy, High Fantasy, Adventure, Fantasy, Magic, Childrens, Adult",Locus Award Nominee for Best Fantasy Novel (1978),
https://www.goodreads.com/book/show/133430.Centennial,133430.0,Centennial,0,James A. Michener,4.24,39748.0,39748.0,1056.0,1974.0,False,"Historical, Historical Fiction, Fiction, Historical, Westerns, Classics, Adventure, Epic, Novels, North American Hi..., American History, Literature",,"Centennial, Colorado"
https://www.goodreads.com/book/show/139069.Endurance,139069.0,Endurance: Shackleton's Incredible Voyage,1,Alfred Lansing,4.38,92255.0,92255.0,282.0,1959.0,False,"Nonfiction, History, Adventure, Biography, Travel, Audiobook, Adventure, Survival, Historical, Leadership, Environment, Nature",National Book Award Finalist for Nonfiction (1960),
https://www.goodreads.com/book/show/540020.The_Day_of_the_Jackal,540020.0,The Day of the Jackal,2,Frederick Forsyth,4.26,123074.0,123074.0,358.0,1971.0,False,"Fiction, Thriller, Mystery, Mystery, Crime, Spy Thriller, Espionage, Suspense, Historical, Historical Fiction, Drama, Thriller, Mystery Thriller, Novels","Martin Beck Award (1972), Edgar Award for Best Novel (1972)","France, Paris"
https://www.goodreads.com/book/show/8520610-quiet,8520610.0,Quiet: The Power of Introverts in a World That Can't Stop Talking,3,Susan Cain,4.06,347856.0,347856.0,352.0,2012.0,False,"Nonfiction, Psychology, Self Help, Science, Business, Audiobook, Self Help, Personal Development, Sociology, Leadership, Adult","Guardian First Book Award Nominee for Longlist (2012), Andrew Carnegie Medal Nominee for Nonfiction (Shortlist) (2015), Goodreads Choice Award for Nonfiction (2012)",
https://www.goodreads.com/book/show/30186948-think-and-grow-rich,30186948.0,Think and Grow Rich,0,Napoleon Hill,4.18,239091.0,239091.0,233.0,1937.0,False,"Business, Self Help, Nonfiction, Economics, Finance, Self Help, Personal Development, Psychology, Currency, Money, Finance, Personal Finance, Philosophy, Business, Entrepreneurship",,
https://www.goodreads.com/book/show/56759.The_Mayor_of_Casterbridge,56759.0,The Mayor of Casterbridge,0,Thomas Hardy,3.84,55543.0,55543.0,445.0,1886.0,False,"Classics, Fiction, Literature, Literature, 19th Century, European Literature, British Literature, Novels, Historical, Victorian, Historical, Historical Fiction, Classics, Classic Literature, Literary Fiction",,"United Kingdom, Wessex, England, Casterbridge, England"
https://www.goodreads.com/book/show/11607446-the-wishing-spell,11607446.0,The Wishing Spell,1,Chris Colfer,4.24,105009.0,105009.0,438.0,2012.0,True,"Fantasy, Childrens, Middle Grade, Childrens, Fiction, Young Adult, Fantasy, Fairy Tales, Adventure, Audiobook, Fantasy, Magic, Retellings",Goodreads Choice Award Nominee for Middle Grade & Children's (2012),
https://www.goodreads.com/book/show/10626594-the-scorpio-races,10626594.0,The Scorpio Races,8,Maggie Stiefvater,4.06,104409.0,104409.0,409.0,2011.0,False,"Fantasy, Young Adult, Romance, Fiction, Fantasy, Mythology, Audiobook, Young Adult, Young Adult Fantasy, Fantasy, Paranormal, Adventure, Young Adult, Teen","Mythopoeic Fantasy Award Nominee for Children's Literature (2012), Odyssey Award Nominee (2012), Los Angeles Times Book Prize Nominee for Young Adult Literature (2011), Michael L. Printz Award Nominee (2012), Milwaukee County Teen Book Award Nominee (2013), The Inky Awards Nominee for Silver Inky (2012), Carnegie Medal Nominee (2013), Premio El Templo de las Mil Puertas for Mejor novela extranjera independiente (2013)",Thisby
https://www.goodreads.com/book/show/27883214-caraval,27883214.0,Caraval,2,Stephanie Garber,3.96,173292.0,173292.0,432.0,2017.0,True,"Fantasy, Young Adult, Romance, Fiction, Young Adult, Young Adult Fantasy, Fantasy, Magic, Mystery, Audiobook, Adventure, Fantasy, High Fantasy","Rhode Island Teen Book Award Nominee (2020), Goodreads Choice Award Nominee for Young Adult Fantasy & Science Fiction & for Debut Goodreads Author (2017)",
https://www.goodreads.com/book/show/5954.Narcissus_and_Goldmund,5954.0,Narcissus and Goldmund,1,Hermann Hesse,4.22,47884.0,47884.0,320.0,1930.0,False,"Fiction, Classics, Philosophy, European Literature, German Literature, Literature, Novels, Cultural, Germany, Historical, Historical Fiction, Literature, 20th Century, Spirituality",Schlegel-Tieck Prize Nominee for Leila Vennewitz (1994),Mariabronn
https://www.goodreads.com/book/show/68783.Girl_Interrupted,68783.0,"Girl, Interrupted",0,Susanna Kaysen,3.9,187560.0,187560.0,169.0,1993.0,False,"Nonfiction, Autobiography, Memoir, Psychology, Health, Mental Health, Mental Health, Mental Illness, Biography, Biography Memoir, Biography, Autobiography, Classics, Adult",,
https://www.goodreads.com/book/show/32585.Hunger,32585.0,Hunger,0,Knut Hamsun,4.05,44603.0,44603.0,134.0,1890.0,False,"Fiction, Classics, Literature, Novels, European Literature, Scandinavian Literature, Literature, 19th Century, Nobel Prize, Philosophy, Literary Fiction, Drama",,Kristiania (Oslo)
https://www.goodreads.com/book/show/16160797-the-cuckoo-s-calling,16160797.0,The Cuckoo's Calling,3,Robert Galbraith,3.86,505315.0,505315.0,456.0,2013.0,True,"Mystery, Fiction, Mystery, Crime, Thriller, Thriller, Mystery Thriller, Audiobook, Adult, Contemporary, Mystery, Detective, Adult Fiction","Anthony Award for Best Audio Book (2014), Los Angeles Times Book Prize for Mystery/Thriller (2013), Goodreads Choice Award Nominee for Mystery & Thriller (2013)","London, England"
https://www.goodreads.com/book/show/15731779-entwined-with-you,15731779.0,Entwined with You,1,Sylvia Day,4.19,183380.0,183380.0,356.0,2013.0,True,"Romance, Adult Fiction, Erotica, Contemporary, Romance, Contemporary Romance, Adult, Romance, Erotic Romance, Erotica, BDSM, Fiction, New Adult, Womens Fiction, Chick Lit",Goodreads Choice Award Nominee for Romance (2013),New York State
https://www.goodreads.com/book/show/7572.Even_Cowgirls_Get_the_Blues,7572.0,Even Cowgirls Get the Blues,1,Tom Robbins,3.77,50230.0,50230.0,366.0,1976.0,False,"Fiction, Humor, Novels, Literature, Contemporary, Magical Realism, Literary Fiction, Literature, American, Adult, Adult Fiction",Washington State Book Award (1977),
https://www.goodreads.com/book/show/28381.Dead_Souls,28381.0,Dead Souls,0,Nikolai Gogol,3.97,69952.0,69952.0,464.0,1842.0,False,"Classics, Fiction, Cultural, Russia, Literature, Russian Literature, Literature, Novels, Literature, 19th Century, Historical, Historical Fiction, Humor, Classics, Classic Literature",,Russian Empire
https://www.goodreads.com/book/show/331920.Flipped,331920.0,Flipped,6,Wendelin Van Draanen,3.95,101172.0,101172.0,212.0,2001.0,False,"Young Adult, Romance, Fiction, Contemporary, Realistic Fiction, Childrens, Middle Grade, Childrens, Young Adult, Teen, Young Adult, Coming Of Age, Humor","South Carolina Book Award for Junior Book Award (2004), Nevada Young Readers' Award, Dorothy Canfield Fisher Children's Book Award Nominee (2003), California Young Readers Medal for Middle School/Junior High (2004), Judy Lopez Memorial Award for Children's Literature Nominee (2002), Virginia Reader's Choice for Middle (2003)",
https://www.goodreads.com/book/show/5695.Demons,5695.0,Demons,0,Fyodor Dostoyevsky,4.28,39244.0,39244.0,733.0,1872.0,False,"Classics, Fiction, Cultural, Russia, Literature, Russian Literature, Literature, Philosophy, Novels, Literature, 19th Century, Classics, Classic Literature, Politics",,Russia
https://www.goodreads.com/book/show/1379961.People_of_the_Book,1379961.0,People of the Book,7,Geraldine Brooks,4.01,128750.0,128750.0,372.0,2008.0,False,"Historical, Historical Fiction, Fiction, Historical, Writing, Books About Books, Mystery, Book Club, Literature, Jewish, Religion, Adult Fiction, Audiobook","National Jewish Book Award Nominee (2008), Massachusetts Book Award for Fiction (2009), Prime Minister's Literary Awards Nominee for Fiction (2009), Barbara Jefferis Award Nominee (2009), Australian Book Industry Award (ABIA) for Literary Fiction and for Book of the Year (2008), Mary Shelley Award for Outstanding Fictional Work (2009), International Dublin Literary Award Nominee (2010)","Sarajevo, Sarajevo, Bosnia and Herzegovina"
https://www.goodreads.com/book/show/9659607-the-iron-knight,9659607.0,The Iron Knight,1,Julie Kagawa,4.18,80722.0,80722.0,400.0,2011.0,True,"Fantasy, Young Adult, Romance, Fantasy, Paranormal, Fairies, Fae, Paranormal, Fairies, Fantasy, Magic, Fantasy, Urban Fantasy, Young Adult, Young Adult Fantasy, Fiction",Goodreads Choice Award Nominee for Young Adult Fantasy & Science Fiction (2011),Nevernever
https://www.goodreads.com/book/show/23754.Preludes_Nocturnes,23754.0,Preludes & Nocturnes,0,Neil Gaiman,4.23,222004.0,222004.0,233.0,1991.0,True,"Sequential Art, Graphic Novels, Sequential Art, Comics, Fantasy, Fiction, Horror, Graphic Novels Comics, Comics, Comic Book, Fantasy, Mythology, Fantasy, Urban Fantasy, Adult",,
https://www.goodreads.com/book/show/35879147-betrayal-of-faith,35879147.0,Betrayal of Faith,0,Mark M. Bello,4.31,6868.0,6868.0,496.0,2017.0,True,"Contemporary, Fiction, Drama, Novels, Epic",,
https://www.goodreads.com/book/show/13312527-the-opportunist,13312527.0,The Opportunist,0,Tarryn Fisher,4.21,49382.0,49382.0,278.0,2011.0,True,"Romance, New Adult, Contemporary, Romance, Contemporary Romance, Adult, Womens Fiction, Chick Lit, Drama, Fiction, Academic, College, Young Adult",,Florida
https://www.goodreads.com/book/show/25701594-complicate-me,25701594.0,Complicate Me,0,M.  Robinson,4.02,9739.0,9739.0,397.0,2015.0,True,"Romance, New Adult, Romance, Contemporary Romance, Contemporary, Academic, College, Young Adult, Young Adult, High School, Young Adult, Coming Of Age, Drama, Adult",,
https://www.goodreads.com/book/show/50365.A_Suitable_Boy,50365.0,A Suitable Boy,2,Vikram Seth,4.12,43557.0,43557.0,1474.0,1993.0,True,"Fiction, Cultural, India, Historical, Historical Fiction, Asian Literature, Indian Literature, Classics, Romance, Cultural, Asia, Historical, Novels, Literary Fiction","WH Smith Literary Award (1994), Commonwealth Writers' Prize for Best Book Overall (1994)","Delhi, Kanpur, Calcutta, Brahmapur, India"
https://www.goodreads.com/book/show/7933292-heaven-is-for-real,7933292.0,Heaven is for Real: A Little Boy's Astounding Story of His Trip to Heaven and Back,0,Todd Burpo,4.01,285464.0,285464.0,162.0,2010.0,False,"Nonfiction, Christian, Religion, Inspirational, Spirituality, Autobiography, Memoir, Biography, Religion, Faith, Religion, Christianity, Christian, Christian Non Fiction",,
https://www.goodreads.com/book/show/5166.Midwives,5166.0,Midwives,0,Chris Bohjalian,3.99,152195.0,152195.0,384.0,1997.0,False,"Fiction, Contemporary, Adult Fiction, Book Club, Adult, Womens Fiction, Chick Lit, Mystery, Novels, Historical, Historical Fiction, Drama",,Vermont
https://www.goodreads.com/book/show/2479827.Eragon_Eldest_Brisingr,2479827.0,"Eragon, Eldest & Brisingr",0,Christopher Paolini,4.23,32766.0,32766.0,1952.0,2008.0,True,"Fantasy, Young Adult, Fiction, Fantasy, Dragons, Fantasy, Magic, Adventure, Science Fiction Fantasy, Fantasy, Epic Fantasy, Childrens, Fantasy, High Fantasy",,
https://www.goodreads.com/book/show/8073.Cloudy_With_a_Chance_of_Meatballs,8073.0,Cloudy With a Chance of Meatballs,1,Judi Barrett,4.16,132875.0,132875.0,32.0,1978.0,True,"Childrens, Picture Books, Childrens, Fiction, Fantasy, Classics, Food and Drink, Food, Humor, Kids, Childrens, Juvenile, Science Fiction Fantasy",California Young Readers Medal Nominee for Primary (1982),
https://www.goodreads.com/book/show/15812814-crossed,15812814.0,Crossed,0,Ally Condie,3.53,221727.0,221727.0,367.0,2011.0,True,"Young Adult, Science Fiction, Dystopia, Romance, Science Fiction, Fiction, Fantasy, Young Adult, Teen, Adventure, Audiobook, Apocalyptic, Post Apocalyptic",,
